{"algorithm":"sha256","canonicalization":"RFC8785","contractVersion":"1.0.0","formatVersion":"1.0.0","schemas":[{"path":"actor.schema.json","sha256":"67446d851703fd3a3af135230d6fc3af70c0a337a65eda0684f053b1fa685ebe"},{"path":"common.schema.json","sha256":"76c08104289560420196bce44037f1e43fe7ead1212b300ae2276606c2531fdb"},{"path":"entities/action.schema.json","sha256":"7b4ff6bca06164726f0b21ca2e730f1d45299a91b7803d2ae54f07ea20161a94"},{"path":"entities/assumption.schema.json","sha256":"4817eb5e24d4ac8a121d753ebaf8f5c86de35d6599dd036e47a160f9b9d2f197"},{"path":"entities/causal-member.schema.json","sha256":"2ab8a614d50abbb6fd2e97821c7b54d8e26d16afbbf8c81ac58776706b36d798"},{"path":"entities/cause.schema.json","sha256":"8e0b024551705034583a21671ff5977b00dde24f50444febaae46dce7aba96ab"},{"path":"entities/conclusion.schema.json","sha256":"ff24ad20fd50a4a35c13db02f9d83e5d58bbc11ca2878ed0d420017276986273"},{"path":"entities/contradiction.schema.json","sha256":"e7242d4570b3801ba67e9a26b81c117402e80b65791403d3949aaa6d8797130f"},{"path":"entities/corrective-action.schema.json","sha256":"8c6f5422e9d5bd32e2b9ba9784523a95eec45e7c2a1f85b3322ef6503f91c81c"},{"path":"entities/criterion.schema.json","sha256":"7aa63050d1a52341928112afc460410128033dd6b9e08d1c5958121a1eca663b"},{"path":"entities/evidence.schema.json","sha256":"243a19376157e97c3696bf0f99d23fcd6d9cd134347ef95107b8ebf0cabad78b"},{"path":"entities/finding.schema.json","sha256":"23b9c2d53bed6824b1a6399db98da7ad70241171ed4d163bb825b4deb512434c"},{"path":"entities/hypothesis-change.schema.json","sha256":"a48371cbc6ceb5484e1f0e0777b23efbf847682b8af5a2d8a3594d9c11768030"},{"path":"entities/hypothesis.schema.json","sha256":"b8c8f8a5ccad2a0bc64f4e75739f14793e3092f25d3a3b318e45c12c7f30f004"},{"path":"entities/negative-knowledge.schema.json","sha256":"1b8b99ccedc192afd23dc117dd2a899fb7c324589949ca7019e01780a9c87b25"},{"path":"entities/observation.schema.json","sha256":"aaa697a9d18da7ba653e3e17132e3dffdd25159fa632b8af205d67dccee47054"},{"path":"entities/prediction.schema.json","sha256":"2e5a85c1860921e74df94b7c8ad830aca835d2637de0d9c4cc48195e68b29f4e"},{"path":"entities/proposal.schema.json","sha256":"a38987dcbe7edbacb6764c22f143d714f15158428414e325daf0687221831579"},{"path":"entities/relationship.schema.json","sha256":"cbd822c064e94ad3d15994d2c830ead2746aad44cb3c7b94a7eb296d10f60174"},{"path":"entities/unknown.schema.json","sha256":"8a90578eab8cc22e58f018856aa0d026b102331d7791955ebb17e24c45af3247"},{"path":"entities/verification.schema.json","sha256":"f5319468067c611b02ef14935aab6f36ac36afc7d644a180e7e800ac71323290"},{"path":"event-envelope.schema.json","sha256":"d5027fbbbcfbee821fac2ee6147480664997e2adbda79ed8f4f6a2a0a02af31d"},{"path":"golden-scenarios.schema.json","sha256":"d1764bb11fc904053ed5e2018f8ca6be3b5da831d77516cb68c037bdbfc66da3"},{"path":"investigation-manifest.schema.json","sha256":"54aa4cb0e6aac1d372dbc9b1b0a290bff7746a2cae9c4a5d338a68e1ad52f58c"},{"path":"negative-fixture.schema.json","sha256":"cfe502ed7c2ee73b1da5391db92a697be4c465ce7036a7b02995583712b49e89"},{"path":"payloads/ActionRecorded.schema.json","sha256":"9eb1da75216b45d9f368ea1f848621896116c725cb13be46674ea01725f180bb"},{"path":"payloads/ActionTransitioned.schema.json","sha256":"4a3d4ac2fd5e17ebeb2184325e391969d3c541f3233ef50941809f756c1ec959"},{"path":"payloads/AssumptionRecorded.schema.json","sha256":"c0abcc419db68c70863d7c7f05315a45158a7e404bd8aec6e50c775934bbcc69"},{"path":"payloads/AssumptionTransitioned.schema.json","sha256":"594fa0c46104acd43c52e951fa5be3c2ed2a1d0224976be3dd3b2696c3f52032"},{"path":"payloads/CausalAssertionConfirmed.schema.json","sha256":"0593f1772157135acdb2d049521d5737acd2934e61aa2ad8a22b05a211ac2676"},{"path":"payloads/CausalAssertionRecorded.schema.json","sha256":"a5ed4ec07d6fd8de56a89109e5dd7569349d591d1763c4e00663911767edb1e8"},{"path":"payloads/CausalAssertionReopened.schema.json","sha256":"54ddceee107ddff40ad431c992e95fcb37eadb1dfc3a36fe25229b70d2764131"},{"path":"payloads/ConclusionRecorded.schema.json","sha256":"6dbbe1c7872bd854c3968edb3d117fadbb1572fb7bc95194e6eb25fe4ff0d55a"},{"path":"payloads/ContradictionRecorded.schema.json","sha256":"6d9c19561e20d073c8a6547378bd621ab1e58a472450a08b352e3c3106743fc3"},{"path":"payloads/ContradictionTransitioned.schema.json","sha256":"257ac57a451def5e818abf8e0570288bf46591dbfe3d713ccf7880470d0b1e83"},{"path":"payloads/CorrectiveActionRecorded.schema.json","sha256":"5cc3d20e9da1d77440c04adc284489e3dc0aacfabc10774d65d0b1adfc25aea9"},{"path":"payloads/CorrectiveActionTransitioned.schema.json","sha256":"a62b47b0a4ef82461c9a812d20759017b8dd9ed46a710ca52b5abd7b992a1c87"},{"path":"payloads/CriterionRecorded.schema.json","sha256":"2f7316b35d9e95277a4c5cff53d4fd9222a1e55c163fd3fee62f85afa88ae657"},{"path":"payloads/EvidenceAdmitted.schema.json","sha256":"07300078077e147ee2bfc63659f256a4f6f694fa584e5cc7e848489d4a2170ba"},{"path":"payloads/EvidenceRelated.schema.json","sha256":"a4fd1335e00855b74bd40c201424d3b1f87f7876b7946e37d44eec62ce705f03"},{"path":"payloads/EvidenceSuperseded.schema.json","sha256":"b723c8f6207703633f1ed65b8f47febcc22a28de828cf662134175679cf4de89"},{"path":"payloads/EvidenceVerificationAssessed.schema.json","sha256":"400cbf3fbe233912e4f4b3a7690f2625e9593740385e703b61a752334354a568"},{"path":"payloads/FindingRecorded.schema.json","sha256":"84d423b791e4df737b79ad8433cf2b175963598dab8c6b7e03b863301e4a4e87"},{"path":"payloads/HypothesisRecorded.schema.json","sha256":"49ecea8fed1bda3265f4c3eee29bcaac72a32c1678098e17f5d1db635c6cb362"},{"path":"payloads/HypothesisTransitioned.schema.json","sha256":"07a95b9c38c3aac0f52d8025fbf83a933005529ca3ac715f2db357fe6adf982e"},{"path":"payloads/InvestigationStarted.schema.json","sha256":"7cea82ce2b1e1d00145b89e264f97dc55ddbc16ad160b725960b6c04d043e090"},{"path":"payloads/LifecycleChanged.schema.json","sha256":"9c50d42710d6941edb032b93185ab78a085ecbe644bdb3020ccf1e9d51f0d118"},{"path":"payloads/NegativeKnowledgeEstablished.schema.json","sha256":"aefd6ef64af74168fb037f93bcb69a951a30227ccc30ed37de020ba74286f426"},{"path":"payloads/ObservationRecorded.schema.json","sha256":"4672537f66adb3c10d05a5b6943ad6e7e74985b6fcc7155ea46a08fbe856ace1"},{"path":"payloads/PredictionRecorded.schema.json","sha256":"434fa08dcb0326a94e77471fa86fc210544515546e539be7e3cfe5e6affbf5b9"},{"path":"payloads/ProposalRecorded.schema.json","sha256":"7a656d3064a477e70ca30a32013f56c4ec2263db4a8bf487f7de5bfd3a668578"},{"path":"payloads/ProposalWasAccepted.schema.json","sha256":"9b5b8902be2910546b879035c89d9acbbde5085e891502fb75f41e84e12f512b"},{"path":"payloads/ProposalWasRejected.schema.json","sha256":"2fe62c79365d7d19cc4e7257354c4b05c20eceee9e402e1fbb56b983065a6194"},{"path":"payloads/UnknownIdentified.schema.json","sha256":"0508de1c9c3bda485896147f8e7ab428e118883c0a84c616c6fb4b77ec140f01"},{"path":"payloads/UnknownTransitioned.schema.json","sha256":"e37a3bcd7fb2b393c7145db503d1b98f6c9f876f346a37f773fa2d1d18f60cf5"},{"path":"payloads/VerificationRecorded.schema.json","sha256":"6b2ea3f8a450755dd076d3f26b71653f2f683c03842b1f6613ebacee854f835e"},{"path":"root-manifest.schema.json","sha256":"d620fa115ccd311db10d616eb7c33b1440be4bd216126b8e1646883c68ce74f7"},{"path":"schema-bundle.schema.json","sha256":"2bb69110571d2c6873ab5707c099702b3439cdddd500c9424d4ec6e6c13dcb2a"},{"path":"snapshot.schema.json","sha256":"244567c0ff5f66e0e9f06456ec9aefd9178fe0bde18c77b786e618e265b419b0"},{"path":"state.schema.json","sha256":"097a590e029706e8f268329c957b123691a77e16a5c6d47f0dcbb865175227a5"}]}
